{
  "schema_version": "productionWQ-picks.v2",
  "generated_at": "2026-03-25T17:13:59+08:00",
  "racedate": "25-03-2026",
  "venue": "HV",
  "source": {
    "pipeline": "production",
    "config": "prod/HKJC_PROD_WQ.json",
    "code_ref": {
      "git_commit": "2ef5653",
      "script": "hkjc_prod_predict_single_race_wq.py"
    }
  },
  "races": [
    {
      "race_no": 1,
      "W_pick": {
        "horse_no": 7,
        "horse_code": "J331",
        "horse_name_zh": "幸運同行",
        "overlay": 0.04751051561157586,
        "cur_win_odds": 3.6
      },
      "Q_partners": [
        {
          "horse_no": 4,
          "horse_code": "H168",
          "horse_name_zh": "夢照發",
          "overlay": 0.03959299031885882,
          "cur_win_odds": 6
        },
        {
          "horse_no": 6,
          "horse_code": "D241",
          "horse_name_zh": "香港精神",
          "overlay": -0.01913502657906693,
          "cur_win_odds": 10
        }
      ],
      "Q_anchor_horse_no": 7,
      "Q_pairs": [
        "7-4",
        "7-6"
      ]
    },
    {
      "race_no": 2,
      "W_pick": {
        "horse_no": 3,
        "horse_code": "K406",
        "horse_name_zh": "知道穩勝",
        "overlay": 0.11085247208460519,
        "cur_win_odds": 4.4
      },
      "Q_partners": [
        {
          "horse_no": 9,
          "horse_code": "J098",
          "horse_name_zh": "先到先得",
          "overlay": 0.04069438211654405,
          "cur_win_odds": 5.7
        },
        {
          "horse_no": 1,
          "horse_code": "K162",
          "horse_name_zh": "佳登",
          "overlay": 0.024218783524907556,
          "cur_win_odds": 4.8
        }
      ],
      "Q_anchor_horse_no": 3,
      "Q_pairs": [
        "3-9",
        "3-1"
      ]
    },
    {
      "race_no": 3,
      "W_pick": {
        "horse_no": 6,
        "horse_code": "J362",
        "horse_name_zh": "比特星",
        "overlay": 0.2019862629570683,
        "cur_win_odds": 4
      },
      "Q_partners": [
        {
          "horse_no": 5,
          "horse_code": "H459",
          "horse_name_zh": "星運少爵",
          "overlay": 0.11000554979310828,
          "cur_win_odds": 5.4
        },
        {
          "horse_no": 7,
          "horse_code": "K283",
          "horse_name_zh": "可靠大師",
          "overlay": 0.12890182818623075,
          "cur_win_odds": 8.9
        }
      ],
      "Q_anchor_horse_no": 6,
      "Q_pairs": [
        "6-5",
        "6-7"
      ]
    },
    {
      "race_no": 4,
      "W_pick": {
        "horse_no": 6,
        "horse_code": "K155",
        "horse_name_zh": "爆出美麗",
        "overlay": 0.16034755679363935,
        "cur_win_odds": 5.5
      },
      "Q_partners": [
        {
          "horse_no": 4,
          "horse_code": "K003",
          "horse_name_zh": "康昌之星",
          "overlay": 0.012436852194983255,
          "cur_win_odds": 6.1
        },
        {
          "horse_no": 8,
          "horse_code": "K536",
          "horse_name_zh": "八心之星",
          "overlay": 0.010616447318848232,
          "cur_win_odds": 5.5
        }
      ],
      "Q_anchor_horse_no": 6,
      "Q_pairs": [
        "6-4",
        "6-8"
      ]
    },
    {
      "race_no": 5,
      "W_pick": {
        "horse_no": 1,
        "horse_code": "J431",
        "horse_name_zh": "馬力",
        "overlay": 0.04736509317453155,
        "cur_win_odds": 4.6
      },
      "Q_partners": [
        {
          "horse_no": 12,
          "horse_code": "J465",
          "horse_name_zh": "品德寶寶",
          "overlay": 0.09064744806034718,
          "cur_win_odds": 5.5
        },
        {
          "horse_no": 5,
          "horse_code": "E061",
          "horse_name_zh": "人和家興",
          "overlay": 0.23598391983341088,
          "cur_win_odds": 13
        }
      ],
      "Q_anchor_horse_no": 1,
      "Q_pairs": [
        "1-12",
        "1-5"
      ]
    },
    {
      "race_no": 6,
      "W_pick": {
        "horse_no": 3,
        "horse_code": "J539",
        "horse_name_zh": "皇者有利",
        "overlay": 0.1626184947055521,
        "cur_win_odds": 3.4
      },
      "Q_partners": [
        {
          "horse_no": 9,
          "horse_code": "H442",
          "horse_name_zh": "",
          "overlay": -0.026972834908450136,
          "cur_win_odds": null
        },
        {
          "horse_no": 8,
          "horse_code": "H317",
          "horse_name_zh": "花好月盈",
          "overlay": 0.10449677082927364,
          "cur_win_odds": 6.5
        }
      ],
      "Q_anchor_horse_no": 3,
      "Q_pairs": [
        "3-9",
        "3-8"
      ]
    },
    {
      "race_no": 7,
      "W_pick": {
        "horse_no": 8,
        "horse_code": "K325",
        "horse_name_zh": "星辰千帥",
        "overlay": 0.15035161332479757,
        "cur_win_odds": 4.2
      },
      "Q_partners": [
        {
          "horse_no": 3,
          "horse_code": "J143",
          "horse_name_zh": "日馳千里",
          "overlay": 0.16677640402765112,
          "cur_win_odds": 5.6
        },
        {
          "horse_no": 2,
          "horse_code": "K451",
          "horse_name_zh": "踏雪尋梅",
          "overlay": 0.07891475044499044,
          "cur_win_odds": 4.6
        }
      ],
      "Q_anchor_horse_no": 8,
      "Q_pairs": [
        "8-3",
        "8-2"
      ]
    },
    {
      "race_no": 8,
      "W_pick": {
        "horse_no": 1,
        "horse_code": "J260",
        "horse_name_zh": "一起美麗",
        "overlay": 0.05456861316572738,
        "cur_win_odds": 4.5
      },
      "Q_partners": [
        {
          "horse_no": 2,
          "horse_code": "J225",
          "horse_name_zh": "一定掂",
          "overlay": -0.03081636061302633,
          "cur_win_odds": 6.1
        },
        {
          "horse_no": 10,
          "horse_code": "J396",
          "horse_name_zh": "富國兄弟",
          "overlay": 0.12395607185334798,
          "cur_win_odds": 12
        }
      ],
      "Q_anchor_horse_no": 1,
      "Q_pairs": [
        "1-2",
        "1-10"
      ]
    },
    {
      "race_no": 9,
      "W_pick": {
        "horse_no": 5,
        "horse_code": "K434",
        "horse_name_zh": "福星小子",
        "overlay": 0.3328219301335571,
        "cur_win_odds": 4.8
      },
      "Q_partners": [
        {
          "horse_no": 2,
          "horse_code": "L033",
          "horse_name_zh": "粵港資駒",
          "overlay": -0.05447580442053539,
          "cur_win_odds": 3.7
        },
        {
          "horse_no": 8,
          "horse_code": "J370",
          "horse_name_zh": "加州本事",
          "overlay": 0.13589239859458002,
          "cur_win_odds": 14
        }
      ],
      "Q_anchor_horse_no": 5,
      "Q_pairs": [
        "5-2",
        "5-8"
      ]
    }
  ],
  "summary": {
    "races": 9
  }
}